{
  "alternatives": [
    "Direct source search"
  ],
  "counterpressure": [
    "Catalog vocabulary can narrow discovery"
  ],
  "discovered_methods": [
    "Problem-first retrieval"
  ],
  "failures": [
    "Catalog anchoring"
  ],
  "fingerprint": "sha256-v1:942964038968757190e9c7cf963aba7ab5804324ae49ce2ee82f8b7538948a98",
  "intended_essence": "Bounded evidence discovery",
  "m0_units": [
    "Retrieve evidence only after independent discovery"
  ],
  "packet_id": "M0-fixture-independent",
  "pre_discovery_fixed_point_fingerprint": "sha256-v1:ffffffffffffffffffffffffffffffffffffffffffffffffffffffffffffffff",
  "schema_version": 1,
  "unresolved_named_gaps": [
    "Whether one authority boundary is reusable"
  ],
  "wrong_conditions": [
    "No reusable evidence dimension exists"
  ]
}
